15:39:14.873348 IP localhost.57650 > localhost.webcache: Flags [.], ack 1039713562, win 3637, options [nop,nop,TS val 48097536 ecr 48087520], length 0
15:39:14.873348 IP localhost.57647 > localhost.webcache: Flags [.], ack 1035552985, win 21031, options [nop,nop,TS val 48097536 ecr 48087520], length 0
15:39:14.905313 IP localhost.57645 > localhost.webcache: Flags [.], ack 3269358459, win 23540, options [nop,nop,TS val 48097568 ecr 48087552], length 0
15:39:14.905313 IP localhost.57649 > localhost.webcache: Flags [.], ack 3287225879, win 4660, options [nop,nop,TS val 48097568 ecr 48087552], length 0
15:39:14.905332 IP localhost.webcache > localhost.57645: Flags [.], ack 1, win 582, options [nop,nop,TS val 48097568 ecr 48027450], length 0
15:39:17.509800 IP6 localhost.37451 > localhost.37451: UDP, length 32
15:39:17.520513 IP6 localhost.37451 > localhost.37451: UDP, length 24
15:39:17.522558 IP6 localhost.37451 > localhost.37451: UDP, length 32
15:39:17.533590 IP6 localhost.37451 > localhost.37451: UDP, length 976
15:39:17.533651 IP6 localhost.37451 > localhost.37451: UDP, length 248
15:39:17.533666 IP6 localhost.37451 > localhost.37451: UDP, length 456
15:39:24.889295 IP localhost.57646 > localhost.webcache: Flags [.], ack 1589048121, win 5683, options [nop,nop,TS val 48107552 ecr 48097536], length 0
15:39:24.889295 IP localhost.57647 > localhost.webcache: Flags [.], ack 1, win 21031, options [nop,nop,TS val 48107552 ecr 48097536], length 0
15:39:24.889295 IP localhost.57650 > localhost.webcache: Flags [.], ack 1, win 3637, options [nop,nop,TS val 48107552 ecr 48097536], length 0
15:39:24.889318 IP localhost.webcache > localhost.57648: Flags [.], ack 1731868464, win 375, options [nop,nop,TS val 48107552 ecr 48027431], length 0
15:39:24.921288 IP localhost.57645 > localhost.webcache: Flags [.], ack 1, win 23540, options [nop,nop,TS val 48107584 ecr 48097568], length 0
15:39:24.921288 IP localhost.57649 > localhost.webcache: Flags [.], ack 1, win 4660, options [nop,nop,TS val 48107584 ecr 48097568], length 0
15:39:24.921318 IP localhost.webcache > localhost.57645: Flags [.], ack 1, win 582, options [nop,nop,TS val 48107584 ecr 48027450], length 0
15:39:24.921318 IP localhost.webcache > localhost.57649: Flags [.], ack 1, win 375, options [nop,nop,TS val 48107584 ecr 48027490], length 0
15:39:24.992997 IP localhost.57650 > localhost.webcache: Flags [P.], seq 1:623, ack 1, win 3637, options [nop,nop,TS val 48107655 ecr 48107552], length 622: HTTP: GET /graphene-visual-testing-webapp/rest/suites/35 HTTP/1.1
15:39:24.995399 IP localhost.49472 > localhost.postgres: Flags [P.], seq 1796119050:1796121574, ack 3026444248, win 18423, options [nop,nop,TS val 48107658 ecr 48025743], length 2524
15:39:24.996777 IP localhost.postgres > localhost.49472: Flags [P.], seq 1:8193, ack 2524, win 3637, options [nop,nop,TS val 48107659 ecr 48107658], length 8192
15:39:24.996840 IP localhost.postgres > localhost.49472: Flags [P.], seq 8193:12213, ack 2524, win 3637, options [nop,nop,TS val 48107659 ecr 48107658], length 4020
15:39:24.996863 IP localhost.49472 > localhost.postgres: Flags [.], ack 8193, win 18423, options [nop,nop,TS val 48107659 ecr 48107659], length 0
15:39:24.996883 IP localhost.49472 > localhost.postgres: Flags [.], ack 12213, win 18404, options [nop,nop,TS val 48107659 ecr 48107659], length 0
15:39:24.997624 IP localhost.49472 > localhost.postgres: Flags [P.], seq 2524:2907, ack 12213, win 18423, options [nop,nop,TS val 48107660 ecr 48107659], length 383
15:39:24.997883 IP localhost.postgres > localhost.49472: Flags [P.], seq 12213:15388, ack 2907, win 3637, options [nop,nop,TS val 48107660 ecr 48107660], length 3175
15:39:24.998124 IP localhost.49472 > localhost.postgres: Flags [P.], seq 2907:3457, ack 15388, win 18423, options [nop,nop,TS val 48107660 ecr 48107660], length 550
15:39:24.998313 IP localhost.postgres > localhost.49472: Flags [P.], seq 15388:16146, ack 3457, win 3637, options [nop,nop,TS val 48107661 ecr 48107660], length 758
15:39:24.998565 IP localhost.49472 > localhost.postgres: Flags [P.], seq 3457:3840, ack 16146, win 18423, options [nop,nop,TS val 48107661 ecr 48107661], length 383
15:39:24.998767 IP localhost.postgres > localhost.49472: Flags [P.], seq 16146:18587, ack 3840, win 3637, options [nop,nop,TS val 48107661 ecr 48107661], length 2441
15:39:24.998992 IP localhost.49472 > localhost.postgres: Flags [P.], seq 3840:5841, ack 18587, win 18423, options [nop,nop,TS val 48107661 ecr 48107661], length 2001
15:39:24.999591 IP localhost.postgres > localhost.49472: Flags [P.], seq 18587:19645, ack 5841, win 3637, options [nop,nop,TS val 48107662 ecr 48107661], length 1058
15:39:24.999794 IP localhost.49472 > localhost.postgres: Flags [P.], seq 5841:6224, ack 19645, win 18423, options [nop,nop,TS val 48107662 ecr 48107662], length 383
15:39:24.999962 IP localhost.postgres > localhost.49472: Flags [P.], seq 19645:22086, ack 6224, win 3637, options [nop,nop,TS val 48107662 ecr 48107662], length 2441
15:39:25.000188 IP localhost.49472 > localhost.postgres: Flags [P.], seq 6224:8225, ack 22086, win 18423, options [nop,nop,TS val 48107662 ecr 48107662], length 2001
15:39:25.000744 IP localhost.postgres > localhost.49472: Flags [P.], seq 22086:23144, ack 8225, win 3637, options [nop,nop,TS val 48107663 ecr 48107662], length 1058
15:39:25.000948 IP localhost.49472 > localhost.postgres: Flags [P.], seq 8225:8608, ack 23144, win 18423, options [nop,nop,TS val 48107663 ecr 48107663], length 383
15:39:25.001122 IP localhost.postgres > localhost.49472: Flags [P.], seq 23144:25585, ack 8608, win 3637, options [nop,nop,TS val 48107663 ecr 48107663], length 2441
15:39:25.001401 IP localhost.49472 > localhost.postgres: Flags [P.], seq 8608:10609, ack 25585, win 18423, options [nop,nop,TS val 48107664 ecr 48107663], length 2001
15:39:25.002530 IP localhost.postgres > localhost.49472: Flags [P.], seq 25585:26643, ack 10609, win 3637, options [nop,nop,TS val 48107665 ecr 48107664], length 1058
15:39:25.003319 IP localhost.49472 > localhost.postgres: Flags [P.], seq 10609:10992, ack 26643, win 18423, options [nop,nop,TS val 48107665 ecr 48107665], length 383
15:39:25.004016 IP localhost.postgres > localhost.49472: Flags [P.], seq 26643:29818, ack 10992, win 3637, options [nop,nop,TS val 48107666 ecr 48107665], length 3175
15:39:25.004696 IP localhost.49472 > localhost.postgres: Flags [P.], seq 10992:12993, ack 29818, win 18423, options [nop,nop,TS val 48107667 ecr 48107666], length 2001
15:39:25.005311 IP localhost.postgres > localhost.49472: Flags [P.], seq 29818:30876, ack 12993, win 3637, options [nop,nop,TS val 48107668 ecr 48107667], length 1058
15:39:25.005653 IP localhost.49472 > localhost.postgres: Flags [P.], seq 12993:13024, ack 30876, win 18423, options [nop,nop,TS val 48107668 ecr 48107668], length 31
15:39:25.005731 IP6 localhost.37451 > localhost.37451: UDP, length 872
15:39:25.005753 IP localhost.postgres > localhost.49472: Flags [P.], seq 30876:30899, ack 13024, win 3637, options [nop,nop,TS val 48107668 ecr 48107668], length 23
15:39:25.006552 IP localhost.webcache > localhost.57650: Flags [P.], seq 1:16615, ack 623, win 365, options [nop,nop,TS val 48107669 ecr 48107655], length 16614: HTTP: HTTP/1.1 200 OK
15:39:25.006579 IP localhost.57650 > localhost.webcache: Flags [.], ack 16615, win 4660, options [nop,nop,TS val 48107669 ecr 48107669], length 0
15:39:25.006642 IP localhost.webcache > localhost.57650: Flags [P.], seq 16615:24081, ack 623, win 365, options [nop,nop,TS val 48107669 ecr 48107669], length 7466: HTTP
15:39:25.006649 IP localhost.57650 > localhost.webcache: Flags [.], ack 24081, win 5683, options [nop,nop,TS val 48107669 ecr 48107669], length 0
15:39:25.006729 IP localhost.webcache > localhost.57650: Flags [P.], seq 24081:28862, ack 623, win 365, options [nop,nop,TS val 48107669 ecr 48107669], length 4781: HTTP
15:39:25.006736 IP localhost.57650 > localhost.webcache: Flags [.], ack 28862, win 6706, options [nop,nop,TS val 48107669 ecr 48107669], length 0
15:39:25.006789 IP localhost.webcache > localhost.57650: Flags [P.], seq 28862:28867, ack 623, win 365, options [nop,nop,TS val 48107669 ecr 48107669], length 5: HTTP
15:39:25.006795 IP localhost.57650 > localhost.webcache: Flags [.], ack 28867, win 6706, options [nop,nop,TS val 48107669 ecr 48107669], length 0
15:39:25.022738 IP localhost.57650 > localhost.webcache: Flags [P.], seq 623:1242, ack 28867, win 6706, options [nop,nop,TS val 48107685 ecr 48107669], length 619: HTTP: GET /graphene-visual-testing-webapp/rest/suites HTTP/1.1
15:39:25.023725 IP localhost.57648 > localhost.webcache: Flags [P.], seq 1:620, ack 0, win 22054, options [nop,nop,TS val 48107686 ecr 48107552], length 619: HTTP: GET /graphene-visual-testing-webapp/rest/suites HTTP/1.1
15:39:25.025198 IP localhost.57649 > localhost.webcache: Flags [P.], seq 1:620, ack 1, win 4660, options [nop,nop,TS val 48107687 ecr 48107584], length 619: HTTP: GET /graphene-visual-testing-webapp/rest/suites HTTP/1.1
15:39:25.026220 IP localhost.57646 > localhost.webcache: Flags [P.], seq 1:620, ack 1, win 5683, options [nop,nop,TS val 48107688 ecr 48107552], length 619: HTTP: GET /graphene-visual-testing-webapp/rest/suites HTTP/1.1
15:39:25.027153 IP localhost.postgres > localhost.48795: Flags [P.], seq 3124927123:3124927353, ack 4207957730, win 8700, options [nop,nop,TS val 48107689 ecr 48107689], length 230
15:39:25.027188 IP localhost.48795 > localhost.postgres: Flags [.], ack 230, win 9212, options [nop,nop,TS val 48107689 ecr 48107689], length 0
15:39:25.027308 IP localhost.57645 > localhost.webcache: Flags [P.], seq 1:620, ack 1, win 23540, options [nop,nop,TS val 48107690 ecr 48107584], length 619: HTTP: GET /graphene-visual-testing-webapp/rest/suites HTTP/1.1
15:39:25.028169 IP localhost.48795 > localhost.postgres: Flags [P.], seq 1:551, ack 230, win 9212, options [nop,nop,TS val 48107690 ecr 48107689], length 550
15:39:25.028885 IP localhost.postgres > localhost.48795: Flags [P.], seq 230:988, ack 551, win 8700, options [nop,nop,TS val 48107691 ecr 48107690], length 758
15:39:25.031573 IP localhost.48516 > localhost.postgres: Flags [P.], seq 2826090351:2826090661, ack 2078560484, win 13817, options [nop,nop,TS val 48107694 ecr 48027241], length 310
15:39:25.031826 IP localhost.postgres > localhost.48516: Flags [P.], seq 1:231, ack 310, win 18935, options [nop,nop,TS val 48107694 ecr 48107694], length 230
15:39:25.031882 IP localhost.48516 > localhost.postgres: Flags [.], ack 231, win 13817, options [nop,nop,TS val 48107694 ecr 48107694], length 0
15:39:25.032224 IP localhost.48516 > localhost.postgres: Flags [P.], seq 310:860, ack 231, win 13817, options [nop,nop,TS val 48107694 ecr 48107694], length 550
15:39:25.032527 IP localhost.postgres > localhost.48516: Flags [P.], seq 231:989, ack 860, win 18935, options [nop,nop,TS val 48107695 ecr 48107694], length 758
15:39:25.032941 IP localhost.48516 > localhost.postgres: Flags [P.], seq 860:1243, ack 989, win 13817, options [nop,nop,TS val 48107695 ecr 48107695], length 383
15:39:25.032941 IP localhost.48795 > localhost.postgres: Flags [P.], seq 551:934, ack 988, win 9212, options [nop,nop,TS val 48107695 ecr 48107691], length 383
15:39:25.033216 IP localhost.postgres > localhost.48516: Flags [P.], seq 989:4164, ack 1243, win 18935, options [nop,nop,TS val 48107695 ecr 48107695], length 3175
15:39:25.033217 IP localhost.postgres > localhost.48795: Flags [P.], seq 988:4163, ack 934, win 8700, options [nop,nop,TS val 48107695 ecr 48107695], length 3175
15:39:25.033600 IP localhost.48516 > localhost.postgres: Flags [P.], seq 1243:3244, ack 4164, win 13817, options [nop,nop,TS val 48107696 ecr 48107695], length 2001
15:39:25.033783 IP localhost.49521 > localhost.postgres: Flags [P.], seq 2811275627:2811275937, ack 2771487946, win 19446, options [nop,nop,TS val 48107696 ecr 48027254], length 310
15:39:25.033987 IP localhost.postgres > localhost.49521: Flags [P.], seq 1:231, ack 310, win 20470, options [nop,nop,TS val 48107696 ecr 48107696], length 230
15:39:25.034003 IP localhost.49521 > localhost.postgres: Flags [.], ack 231, win 19445, options [nop,nop,TS val 48107696 ecr 48107696], length 0
15:39:25.035870 IP localhost.49615 > localhost.postgres: Flags [P.], seq 3002818952:3002819262, ack 1746073191, win 3637, options [nop,nop,TS val 48107698 ecr 48025753], length 310
15:39:25.036126 IP localhost.postgres > localhost.49615: Flags [P.], seq 1:231, ack 310, win 3637, options [nop,nop,TS val 48107698 ecr 48107698], length 230
15:39:25.036144 IP localhost.49615 > localhost.postgres: Flags [.], ack 231, win 3637, options [nop,nop,TS val 48107698 ecr 48107698], length 0
15:39:25.036151 IP localhost.49472 > localhost.postgres: Flags [P.], seq 13334:13884, ack 31129, win 18423, options [nop,nop,TS val 48107698 ecr 48107697], length 550
15:39:25.036453 IP localhost.postgres > localhost.49472: Flags [P.], seq 31129:31887, ack 13884, win 3637, options [nop,nop,TS val 48107699 ecr 48107698], length 758
15:39:25.036463 IP localhost.48516 > localhost.postgres: Flags [P.], seq 3244:5177, ack 7968, win 13817, options [nop,nop,TS val 48107699 ecr 48107697], length 1933
15:39:25.036811 IP localhost.49472 > localhost.postgres: Flags [P.], seq 13884:14267, ack 31887, win 18423, options [nop,nop,TS val 48107699 ecr 48107699], length 383
15:39:25.037006 IP localhost.postgres > localhost.48516: Flags [P.], seq 7968:10063, ack 5177, win 18935, options [nop,nop,TS val 48107699 ecr 48107699], length 2095
15:39:25.037011 IP localhost.postgres > localhost.49472: Flags [P.], seq 31887:35062, ack 14267, win 3637, options [nop,nop,TS val 48107699 ecr 48107699], length 3175
15:39:25.038482 IP localhost.49615 > localhost.postgres: Flags [P.], seq 310:860, ack 231, win 3637, options [nop,nop,TS val 48107701 ecr 48107698], length 550
15:39:25.038839 IP localhost.postgres > localhost.49615: Flags [P.], seq 231:989, ack 860, win 3637, options [nop,nop,TS val 48107701 ecr 48107701], length 758
15:39:25.039867 IP localhost.49615 > localhost.postgres: Flags [P.], seq 860:1243, ack 989, win 3637, options [nop,nop,TS val 48107702 ecr 48107701], length 383
15:39:25.039911 IP localhost.48795 > localhost.postgres: Flags [P.], seq 934:2935, ack 4163, win 9212, options [nop,nop,TS val 48107702 ecr 48107695], length 2001
15:39:25.040088 IP localhost.48516 > localhost.postgres: Flags [P.], seq 5177:7110, ack 10063, win 13817, options [nop,nop,TS val 48107702 ecr 48107699], length 1933
15:39:25.040185 IP localhost.postgres > localhost.49615: Flags [P.], seq 989:4164, ack 1243, win 3637, options [nop,nop,TS val 48107702 ecr 48107702], length 3175
15:39:25.040538 IP localhost.49615 > localhost.postgres: Flags [P.], seq 1243:3244, ack 4164, win 3637, options [nop,nop,TS val 48107703 ecr 48107702], length 2001
15:39:25.040893 IP localhost.postgres > localhost.48516: Flags [P.], seq 10063:12158, ack 7110, win 18935, options [nop,nop,TS val 48107703 ecr 48107702], length 2095
15:39:25.041080 IP localhost.postgres > localhost.48795: Flags [P.], seq 4163:7967, ack 2935, win 8700, options [nop,nop,TS val 48107703 ecr 48107702], length 3804
15:39:25.041190 IP localhost.48516 > localhost.postgres: Flags [P.], seq 7110:7493, ack 12158, win 13817, options [nop,nop,TS val 48107703 ecr 48107703], length 383
15:39:25.042377 IP localhost.postgres > localhost.48795: Flags [P.], seq 7967:10062, ack 4868, win 8700, options [nop,nop,TS val 48107705 ecr 48107704], length 2095
15:39:25.042531 IP localhost.postgres > localhost.48516: Flags [P.], seq 14599:15657, ack 9494, win 18935, options [nop,nop,TS val 48107705 ecr 48107704], length 1058
15:39:25.042763 IP localhost.48516 > localhost.postgres: Flags [P.], seq 9494:9877, ack 15657, win 13817, options [nop,nop,TS val 48107705 ecr 48107705], length 383
15:39:25.042800 IP localhost.48795 > localhost.postgres: Flags [P.], seq 4868:6801, ack 10062, win 9212, options [nop,nop,TS val 48107705 ecr 48107705], length 1933
15:39:25.043018 IP localhost.postgres > localhost.48516: Flags [P.], seq 15657:18098, ack 9877, win 18935, options [nop,nop,TS val 48107705 ecr 48107705], length 2441
15:39:25.043351 IP localhost.48516 > localhost.postgres: Flags [P.], seq 9877:11878, ack 18098, win 13817, options [nop,nop,TS val 48107706 ecr 48107705], length 2001
15:39:25.043726 IP localhost.postgres > localhost.48795: Flags [P.], seq 10062:12157, ack 6801, win 8700, options [nop,nop,TS val 48107706 ecr 48107705], length 2095
15:39:25.044266 IP localhost.48795 > localhost.postgres: Flags [P.], seq 6801:7184, ack 12157, win 9212, options [nop,nop,TS val 48107706 ecr 48107706], length 383
15:39:25.044366 IP localhost.postgres > localhost.48516: Flags [P.], seq 18098:19156, ack 11878, win 18935, options [nop,nop,TS val 48107707 ecr 48107706], length 1058
15:39:25.044555 IP localhost.48516 > localhost.postgres: Flags [P.], seq 11878:12261, ack 19156, win 13817, options [nop,nop,TS val 48107707 ecr 48107707], length 383
15:39:25.044569 IP localhost.49615 > localhost.postgres: Flags [P.], seq 3244:5177, ack 7968, win 3637, options [nop,nop,TS val 48107707 ecr 48107704], length 1933
15:39:25.044570 IP localhost.postgres > localhost.48795: Flags [P.], seq 12157:14598, ack 7184, win 8700, options [nop,nop,TS val 48107707 ecr 48107706], length 2441
15:39:25.044773 IP localhost.postgres > localhost.48516: Flags [P.], seq 19156:21597, ack 12261, win 18935, options [nop,nop,TS val 48107707 ecr 48107707], length 2441
15:39:25.044893 IP localhost.48795 > localhost.postgres: Flags [P.], seq 7184:9185, ack 14598, win 9212, options [nop,nop,TS val 48107707 ecr 48107707], length 2001
15:39:25.045037 IP localhost.48516 > localhost.postgres: Flags [P.], seq 12261:14262, ack 21597, win 13817, options [nop,nop,TS val 48107707 ecr 48107707], length 2001
15:39:25.045596 IP localhost.postgres > localhost.49615: Flags [P.], seq 7968:10063, ack 5177, win 3637, options [nop,nop,TS val 48107708 ecr 48107707], length 2095
15:39:25.045940 IP localhost.postgres > localhost.48516: Flags [P.], seq 21597:22655, ack 14262, win 18935, options [nop,nop,TS val 48107708 ecr 48107707], length 1058
15:39:25.045974 IP localhost.postgres > localhost.48795: Flags [P.], seq 14598:15656, ack 9185, win 8700, options [nop,nop,TS val 48107708 ecr 48107707], length 1058
15:39:25.046047 IP localhost.49615 > localhost.postgres: Flags [P.], seq 5177:7110, ack 10063, win 3637, options [nop,nop,TS val 48107708 ecr 48107708], length 1933
15:39:25.046191 IP localhost.48516 > localhost.postgres: Flags [P.], seq 14262:14645, ack 22655, win 13817, options [nop,nop,TS val 48107708 ecr 48107708], length 383
15:39:25.046193 IP localhost.48795 > localhost.postgres: Flags [P.], seq 9185:9568, ack 15656, win 9212, options [nop,nop,TS val 48107708 ecr 48107708], length 383
15:39:25.046421 IP localhost.postgres > localhost.48516: Flags [P.], seq 22655:25830, ack 14645, win 18935, options [nop,nop,TS val 48107709 ecr 48107708], length 3175
15:39:25.046425 IP localhost.postgres > localhost.48795: Flags [P.], seq 15656:18097, ack 9568, win 8700, options [nop,nop,TS val 48107709 ecr 48107708], length 2441
15:39:25.046773 IP localhost.48795 > localhost.postgres: Flags [P.], seq 9568:11569, ack 18097, win 9212, options [nop,nop,TS val 48107709 ecr 48107709], length 2001
15:39:25.046797 IP localhost.48516 > localhost.postgres: Flags [P.], seq 14645:16646, ack 25830, win 13817, options [nop,nop,TS val 48107709 ecr 48107709], length 2001
15:39:25.047113 IP localhost.postgres > localhost.49615: Flags [P.], seq 10063:12158, ack 7110, win 3637, options [nop,nop,TS val 48107709 ecr 48107708], length 2095
15:39:25.047821 IP localhost.49615 > localhost.postgres: Flags [P.], seq 7110:7493, ack 12158, win 3637, options [nop,nop,TS val 48107710 ecr 48107709], length 383
15:39:25.048001 IP localhost.postgres > localhost.48516: Flags [P.], seq 25830:26888, ack 16646, win 18935, options [nop,nop,TS val 48107710 ecr 48107709], length 1058
15:39:25.048104 IP localhost.postgres > localhost.49615: Flags [P.], seq 12158:14599, ack 7493, win 3637, options [nop,nop,TS val 48107710 ecr 48107710], length 2441
15:39:25.048252 IP localhost.48516 > localhost.postgres: Flags [P.], seq 16646:17029, ack 26888, win 13817, options [nop,nop,TS val 48107710 ecr 48107710], length 383
15:39:25.048326 IP localhost.48795 > localhost.postgres: Flags [P.], seq 11569:11952, ack 19155, win 9212, options [nop,nop,TS val 48107711 ecr 48107710], length 383
15:39:25.048401 IP localhost.49615 > localhost.postgres: Flags [P.], seq 7493:9494, ack 14599, win 3637, options [nop,nop,TS val 48107711 ecr 48107710], length 2001
15:39:25.048486 IP localhost.postgres > localhost.48516: Flags [P.], seq 26888:29919, ack 17029, win 18935, options [nop,nop,TS val 48107711 ecr 48107710], length 3031
15:39:25.048560 IP localhost.postgres > localhost.48795: Flags [P.], seq 19155:21596, ack 11952, win 8700, options [nop,nop,TS val 48107711 ecr 48107711], length 2441
15:39:25.048802 IP localhost.48516 > localhost.postgres: Flags [P.], seq 17029:18962, ack 29919, win 13817, options [nop,nop,TS val 48107711 ecr 48107711], length 1933
15:39:25.048928 IP localhost.48795 > localhost.postgres: Flags [P.], seq 11952:13953, ack 21596, win 9212, options [nop,nop,TS val 48107711 ecr 48107711], length 2001
15:39:25.049516 IP localhost.postgres > localhost.48516: Flags [P.], seq 29919:30944, ack 18962, win 18935, options [nop,nop,TS val 48107712 ecr 48107711], length 1025
15:39:25.049516 IP localhost.postgres > localhost.49615: Flags [P.], seq 14599:15657, ack 9494, win 3637, options [nop,nop,TS val 48107712 ecr 48107711], length 1058
15:39:25.049798 IP localhost.49615 > localhost.postgres: Flags [P.], seq 9494:9877, ack 15657, win 3637, options [nop,nop,TS val 48107712 ecr 48107712], length 383
15:39:25.049840 IP localhost.48516 > localhost.postgres: Flags [P.], seq 18962:20895, ack 30944, win 13817, options [nop,nop,TS val 48107712 ecr 48107712], length 1933
15:39:25.049909 IP localhost.postgres > localhost.48795: Flags [P.], seq 21596:22654, ack 13953, win 8700, options [nop,nop,TS val 48107712 ecr 48107711], length 1058
15:39:25.050073 IP localhost.postgres > localhost.49615: Flags [P.], seq 15657:18098, ack 9877, win 3637, options [nop,nop,TS val 48107712 ecr 48107712], length 2441
15:39:25.050139 IP localhost.48795 > localhost.postgres: Flags [P.], seq 13953:14336, ack 22654, win 9212, options [nop,nop,TS val 48107712 ecr 48107712], length 383
15:39:25.050373 IP localhost.postgres > localhost.48795: Flags [P.], seq 22654:25829, ack 14336, win 8700, options [nop,nop,TS val 48107713 ecr 48107712], length 3175
15:39:25.050385 IP localhost.49615 > localhost.postgres: Flags [P.], seq 9877:11878, ack 18098, win 3637, options [nop,nop,TS val 48107713 ecr 48107712], length 2001
15:39:25.050559 IP localhost.postgres > localhost.48516: Flags [P.], seq 30944:31969, ack 20895, win 18935, options [nop,nop,TS val 48107713 ecr 48107712], length 1025
15:39:25.050732 IP localhost.48795 > localhost.postgres: Flags [P.], seq 14336:16337, ack 25829, win 9212, options [nop,nop,TS val 48107713 ecr 48107713], length 2001
15:39:25.050752 IP localhost.48516 > localhost.postgres: Flags [P.], seq 20895:22828, ack 31969, win 13817, options [nop,nop,TS val 48107713 ecr 48107713], length 1933
15:39:25.051435 IP localhost.postgres > localhost.48516: Flags [P.], seq 31969:32994, ack 22828, win 18935, options [nop,nop,TS val 48107714 ecr 48107713], length 1025
15:39:25.051465 IP localhost.postgres > localhost.49615: Flags [P.], seq 18098:19156, ack 11878, win 3637, options [nop,nop,TS val 48107714 ecr 48107713], length 1058
15:39:25.051715 IP localhost.49615 > localhost.postgres: Flags [P.], seq 11878:12261, ack 19156, win 3637, options [nop,nop,TS val 48107714 ecr 48107714], length 383
15:39:25.051716 IP localhost.postgres > localhost.48795: Flags [P.], seq 25829:26887, ack 16337, win 8700, options [nop,nop,TS val 48107714 ecr 48107713], length 1058
15:39:25.051749 IP localhost.48516 > localhost.postgres: Flags [P.], seq 22828:24761, ack 32994, win 13817, options [nop,nop,TS val 48107714 ecr 48107714], length 1933
15:39:25.051926 IP localhost.48795 > localhost.postgres: Flags [P.], seq 16337:16720, ack 26887, win 9212, options [nop,nop,TS val 48107714 ecr 48107714], length 383
15:39:25.051984 IP localhost.postgres > localhost.49615: Flags [P.], seq 19156:21597, ack 12261, win 3637, options [nop,nop,TS val 48107714 ecr 48107714], length 2441
15:39:25.052151 IP localhost.postgres > localhost.48795: Flags [P.], seq 26887:29918, ack 16720, win 8700, options [nop,nop,TS val 48107714 ecr 48107714], length 3031
15:39:25.052444 IP localhost.49615 > localhost.postgres: Flags [P.], seq 12261:14262, ack 21597, win 3637, options [nop,nop,TS val 48107715 ecr 48107714], length 2001
15:39:25.052585 IP localhost.postgres > localhost.48516: Flags [P.], seq 32994:34019, ack 24761, win 18935, options [nop,nop,TS val 48107715 ecr 48107714], length 1025
15:39:25.052669 IP localhost.48795 > localhost.postgres: Flags [P.], seq 16720:18653, ack 29918, win 9212, options [nop,nop,TS val 48107715 ecr 48107714], length 1933
15:39:25.052832 IP localhost.48516 > localhost.postgres: Flags [P.], seq 24761:26694, ack 34019, win 13817, options [nop,nop,TS val 48107715 ecr 48107715], length 1933
15:39:25.053500 IP localhost.postgres > localhost.48795: Flags [P.], seq 29918:30943, ack 18653, win 8700, options [nop,nop,TS val 48107716 ecr 48107715], length 1025
15:39:25.053589 IP localhost.postgres > localhost.48516: Flags [P.], seq 34019:35044, ack 26694, win 18935, options [nop,nop,TS val 48107716 ecr 48107715], length 1025
15:39:25.053624 IP localhost.postgres > localhost.49615: Flags [P.], seq 21597:22655, ack 14262, win 3637, options [nop,nop,TS val 48107716 ecr 48107715], length 1058
15:39:25.053834 IP localhost.49615 > localhost.postgres: Flags [P.], seq 14262:14645, ack 22655, win 3637, options [nop,nop,TS val 48107716 ecr 48107716], length 383
15:39:25.053854 IP localhost.48516 > localhost.postgres: Flags [P.], seq 26694:28627, ack 35044, win 13817, options [nop,nop,TS val 48107716 ecr 48107716], length 1933
15:39:25.053877 IP localhost.48795 > localhost.postgres: Flags [P.], seq 18653:20586, ack 30943, win 9212, options [nop,nop,TS val 48107716 ecr 48107716], length 1933
15:39:25.054123 IP localhost.postgres > localhost.49615: Flags [P.], seq 22655:25830, ack 14645, win 3637, options [nop,nop,TS val 48107716 ecr 48107716], length 3175
15:39:25.054605 IP localhost.49615 > localhost.postgres: Flags [P.], seq 14645:16646, ack 25830, win 3637, options [nop,nop,TS val 48107717 ecr 48107716], length 2001
15:39:25.054628 IP localhost.postgres > localhost.48795: Flags [P.], seq 30943:31968, ack 20586, win 8700, options [nop,nop,TS val 48107717 ecr 48107716], length 1025
15:39:25.054687 IP localhost.postgres > localhost.48516: Flags [P.], seq 35044:36069, ack 28627, win 18935, options [nop,nop,TS val 48107717 ecr 48107716], length 1025
15:39:25.054858 IP localhost.48795 > localhost.postgres: Flags [P.], seq 20586:22519, ack 31968, win 9212, options [nop,nop,TS val 48107717 ecr 48107717], length 1933
15:39:25.055094 IP localhost.48516 > localhost.postgres: Flags [P.], seq 28627:28658, ack 36069, win 13817, options [nop,nop,TS val 48107717 ecr 48107717], length 31
15:39:25.055185 IP6 localhost.37451 > localhost.37451: UDP, length 872
15:39:25.055214 IP localhost.postgres > localhost.48516: Flags [P.], seq 36069:36092, ack 28658, win 18935, options [nop,nop,TS val 48107717 ecr 48107717], length 23
15:39:25.055426 IP localhost.postgres > localhost.48795: Flags [P.], seq 31968:32993, ack 22519, win 8700, options [nop,nop,TS val 48107718 ecr 48107717], length 1025
15:39:25.055664 IP localhost.48795 > localhost.postgres: Flags [P.], seq 22519:24452, ack 32993, win 9212, options [nop,nop,TS val 48107718 ecr 48107718], length 1933
15:39:25.055796 IP localhost.postgres > localhost.49615: Flags [P.], seq 25830:26888, ack 16646, win 3637, options [nop,nop,TS val 48107718 ecr 48107717], length 1058
15:39:25.056009 IP localhost.49615 > localhost.postgres: Flags [P.], seq 16646:17029, ack 26888, win 3637, options [nop,nop,TS val 48107718 ecr 48107718], length 383
15:39:25.056269 IP localhost.postgres > localhost.49615: Flags [P.], seq 26888:29919, ack 17029, win 3637, options [nop,nop,TS val 48107719 ecr 48107718], length 3031
15:39:25.056335 IP localhost.postgres > localhost.48795: Flags [P.], seq 32993:34018, ack 24452, win 8700, options [nop,nop,TS val 48107719 ecr 48107718], length 1025
15:39:25.056503 IP localhost.49472 > localhost.postgres: Flags [P.], seq 14267:16268, ack 35062, win 18423, options [nop,nop,TS val 48107719 ecr 48107699], length 2001
15:39:25.056659 IP localhost.49615 > localhost.postgres: Flags [P.], seq 17029:18962, ack 29919, win 3637, options [nop,nop,TS val 48107719 ecr 48107719], length 1933
15:39:25.057502 IP localhost.postgres > localhost.49615: Flags [P.], seq 29919:30944, ack 18962, win 3637, options [nop,nop,TS val 48107720 ecr 48107719], length 1025
15:39:25.057592 IP localhost.postgres > localhost.49472: Flags [P.], seq 35062:38866, ack 16268, win 3637, options [nop,nop,TS val 48107720 ecr 48107719], length 3804
15:39:25.057869 IP localhost.49615 > localhost.postgres: Flags [P.], seq 18962:20895, ack 30944, win 3637, options [nop,nop,TS val 48107720 ecr 48107720], length 1933
15:39:25.058034 IP localhost.49472 > localhost.postgres: Flags [P.], seq 16268:18201, ack 38866, win 18423, options [nop,nop,TS val 48107720 ecr 48107720], length 1933
15:39:25.058813 IP localhost.postgres > localhost.49615: Flags [P.], seq 30944:31969, ack 20895, win 3637, options [nop,nop,TS val 48107721 ecr 48107720], length 1025
15:39:25.058813 IP localhost.postgres > localhost.49472: Flags [P.], seq 38866:40961, ack 18201, win 3637, options [nop,nop,TS val 48107721 ecr 48107720], length 2095
15:39:25.059134 IP localhost.49472 > localhost.postgres: Flags [P.], seq 18201:20134, ack 40961, win 18423, options [nop,nop,TS val 48107721 ecr 48107721], length 1933
15:39:25.059134 IP localhost.49615 > localhost.postgres: Flags [P.], seq 20895:22828, ack 31969, win 3637, options [nop,nop,TS val 48107721 ecr 48107721], length 1933
15:39:25.059970 IP localhost.postgres > localhost.49615: Flags [P.], seq 31969:32994, ack 22828, win 3637, options [nop,nop,TS val 48107722 ecr 48107721], length 1025
15:39:25.059970 IP localhost.postgres > localhost.49472: Flags [P.], seq 40961:43056, ack 20134, win 3637, options [nop,nop,TS val 48107722 ecr 48107721], length 2095
15:39:25.060236 IP localhost.49472 > localhost.postgres: Flags [P.], seq 20134:20517, ack 43056, win 18423, options [nop,nop,TS val 48107722 ecr 48107722], length 383
15:39:25.060273 IP localhost.49615 > localhost.postgres: Flags [P.], seq 22828:24761, ack 32994, win 3637, options [nop,nop,TS val 48107723 ecr 48107722], length 1933
15:39:25.060503 IP localhost.postgres > localhost.49472: Flags [P.], seq 43056:45497, ack 20517, win 3637, options [nop,nop,TS val 48107723 ecr 48107722], length 2441
15:39:25.060867 IP localhost.49472 > localhost.postgres: Flags [P.], seq 20517:22518, ack 45497, win 18423, options [nop,nop,TS val 48107723 ecr 48107723], length 2001
15:39:25.061113 IP localhost.postgres > localhost.49615: Flags [P.], seq 32994:34019, ack 24761, win 3637, options [nop,nop,TS val 48107723 ecr 48107723], length 1025
15:39:25.061374 IP localhost.49615 > localhost.postgres: Flags [P.], seq 24761:26694, ack 34019, win 3637, options [nop,nop,TS val 48107724 ecr 48107723], length 1933
15:39:25.061890 IP localhost.postgres > localhost.49472: Flags [P.], seq 45497:46555, ack 22518, win 3637, options [nop,nop,TS val 48107724 ecr 48107723], length 1058
15:39:25.062148 IP localhost.postgres > localhost.49615: Flags [P.], seq 34019:35044, ack 26694, win 3637, options [nop,nop,TS val 48107724 ecr 48107724], length 1025
15:39:25.062205 IP localhost.49472 > localhost.postgres: Flags [P.], seq 22518:22901, ack 46555, win 18423, options [nop,nop,TS val 48107724 ecr 48107724], length 383
15:39:25.062259 IP localhost.webcache > localhost.57650: Flags [.], ack 1242, win 377, options [nop,nop,TS val 48107725 ecr 48107685], length 0
15:39:25.062370 IP localhost.49615 > localhost.postgres: Flags [P.], seq 26694:28627, ack 35044, win 3637, options [nop,nop,TS val 48107725 ecr 48107724], length 1933
15:39:25.062501 IP localhost.postgres > localhost.49472: Flags [P.], seq 46555:48996, ack 22901, win 3637, options [nop,nop,TS val 48107725 ecr 48107724], length 2441
15:39:25.062566 IP localhost.49521 > localhost.postgres: Flags [P.], seq 860:1243, ack 989, win 19446, options [nop,nop,TS val 48107725 ecr 48107697], length 383
15:39:25.062817 IP localhost.postgres > localhost.49521: Flags [P.], seq 989:4164, ack 1243, win 20470, options [nop,nop,TS val 48107725 ecr 48107725], length 3175
15:39:25.062846 IP localhost.49472 > localhost.postgres: Flags [P.], seq 22901:24902, ack 48996, win 18423, options [nop,nop,TS val 48107725 ecr 48107725], length 2001
15:39:25.063204 IP localhost.postgres > localhost.49615: Flags [P.], seq 35044:36069, ack 28627, win 3637, options [nop,nop,TS val 48107725 ecr 48107725], length 1025
15:39:25.063261 IP localhost.webcache > localhost.57648: Flags [.], ack 620, win 386, options [nop,nop,TS val 48107726 ecr 48107686], length 0
15:39:25.063394 IP localhost.49521 > localhost.postgres: Flags [P.], seq 1243:3244, ack 4164, win 19446, options [nop,nop,TS val 48107726 ecr 48107725], length 2001
15:39:25.063581 IP localhost.49615 > localhost.postgres: Flags [P.], seq 28627:28658, ack 36069, win 3637, options [nop,nop,TS val 48107726 ecr 48107725], length 31
15:39:25.064221 IP localhost.49472 > localhost.postgres: Flags [P.], seq 24902:25285, ack 50054, win 18423, options [nop,nop,TS val 48107726 ecr 48107726], length 383
15:39:25.064259 IP localhost.webcache > localhost.57649: Flags [.], ack 620, win 386, options [nop,nop,TS val 48107727 ecr 48107687], length 0
15:39:25.064509 IP localhost.webcache > localhost.57650: Flags [P.], seq 28867:45481, ack 1242, win 377, options [nop,nop,TS val 48107727 ecr 48107685], length 16614: HTTP: HTTP/1.1 200 OK
15:39:25.064537 IP localhost.webcache > localhost.57650: Flags [P.], seq 45481:49604, ack 1242, win 377, options [nop,nop,TS val 48107727 ecr 48107685], length 4123: HTTP
15:39:25.064544 IP localhost.postgres > localhost.49472: Flags [P.], seq 50054:52495, ack 25285, win 3637, options [nop,nop,TS val 48107727 ecr 48107726], length 2441
15:39:25.064576 IP localhost.webcache > localhost.57650: Flags [P.], seq 49604:49609, ack 1242, win 377, options [nop,nop,TS val 48107727 ecr 48107685], length 5: HTTP
15:39:25.064740 IP localhost.postgres > localhost.49521: Flags [P.], seq 4164:7968, ack 3244, win 20470, options [nop,nop,TS val 48107727 ecr 48107726], length 3804
15:39:25.064766 IP localhost.57650 > localhost.webcache: Flags [.], ack 49609, win 8752, options [nop,nop,TS val 48107727 ecr 48107727], length 0
15:39:25.065019 IP localhost.49472 > localhost.postgres: Flags [P.], seq 25285:27286, ack 52495, win 18423, options [nop,nop,TS val 48107727 ecr 48107727], length 2001
15:39:25.065215 IP localhost.49521 > localhost.postgres: Flags [P.], seq 3244:5177, ack 7968, win 19446, options [nop,nop,TS val 48107727 ecr 48107727], length 1933
15:39:25.066085 IP localhost.postgres > localhost.49472: Flags [P.], seq 52495:53553, ack 27286, win 3637, options [nop,nop,TS val 48107728 ecr 48107727], length 1058
15:39:25.066265 IP localhost.postgres > localhost.49521: Flags [P.], seq 7968:10063, ack 5177, win 20470, options [nop,nop,TS val 48107728 ecr 48107727], length 2095
15:39:25.066263 IP localhost.webcache > localhost.57646: Flags [.], ack 620, win 390, options [nop,nop,TS val 48107729 ecr 48107688], length 0
15:39:25.066442 IP localhost.49472 > localhost.postgres: Flags [P.], seq 27286:27669, ack 53553, win 18423, options [nop,nop,TS val 48107729 ecr 48107728], length 383
15:39:25.066679 IP localhost.49521 > localhost.postgres: Flags [P.], seq 5177:7110, ack 10063, win 19446, options [nop,nop,TS val 48107729 ecr 48107728], length 1933
15:39:25.066711 IP localhost.postgres > localhost.49472: Flags [P.], seq 53553:56728, ack 27669, win 3637, options [nop,nop,TS val 48107729 ecr 48107729], length 3175
15:39:25.067103 IP localhost.49472 > localhost.postgres: Flags [P.], seq 27669:29670, ack 56728, win 18423, options [nop,nop,TS val 48107729 ecr 48107729], length 2001
15:39:25.067260 IP localhost.webcache > localhost.57645: Flags [.], ack 620, win 593, options [nop,nop,TS val 48107730 ecr 48107690], length 0
15:39:25.067683 IP localhost.postgres > localhost.49521: Flags [P.], seq 10063:12158, ack 7110, win 20470, options [nop,nop,TS val 48107730 ecr 48107729], length 2095
15:39:25.067983 IP localhost.49521 > localhost.postgres: Flags [P.], seq 7110:7493, ack 12158, win 19446, options [nop,nop,TS val 48107730 ecr 48107730], length 383
15:39:25.068257 IP localhost.postgres > localhost.49521: Flags [P.], seq 12158:14599, ack 7493, win 20470, options [nop,nop,TS val 48107730 ecr 48107730], length 2441
15:39:25.068495 IP localhost.49472 > localhost.postgres: Flags [P.], seq 29670:30053, ack 57786, win 18423, options [nop,nop,TS val 48107731 ecr 48107730], length 383
15:39:25.068802 IP localhost.postgres > localhost.49472: Flags [P.], seq 57786:60817, ack 30053, win 3637, options [nop,nop,TS val 48107731 ecr 48107731], length 3031
15:39:25.068825 IP localhost.49521 > localhost.postgres: Flags [P.], seq 7493:9494, ack 14599, win 19446, options [nop,nop,TS val 48107731 ecr 48107730], length 2001
15:39:25.069273 IP localhost.49472 > localhost.postgres: Flags [P.], seq 30053:31986, ack 60817, win 18423, options [nop,nop,TS val 48107732 ecr 48107731], length 1933
15:39:25.070066 IP localhost.postgres > localhost.49521: Flags [P.], seq 14599:15657, ack 9494, win 20470, options [nop,nop,TS val 48107732 ecr 48107731], length 1058
15:39:25.070087 IP localhost.postgres > localhost.49472: Flags [P.], seq 60817:61842, ack 31986, win 3637, options [nop,nop,TS val 48107732 ecr 48107732], length 1025
15:39:25.070384 IP localhost.49521 > localhost.postgres: Flags [P.], seq 9494:9877, ack 15657, win 19446, options [nop,nop,TS val 48107733 ecr 48107732], length 383
15:39:25.070405 IP localhost.49472 > localhost.postgres: Flags [P.], seq 31986:33919, ack 61842, win 18423, options [nop,nop,TS val 48107733 ecr 48107732], length 1933
15:39:25.070801 IP localhost.postgres > localhost.49521: Flags [P.], seq 15657:18098, ack 9877, win 20470, options [nop,nop,TS val 48107733 ecr 48107733], length 2441
15:39:25.072069 IP localhost.49521 > localhost.postgres: Flags [P.], seq 9877:11878, ack 18098, win 19446, options [nop,nop,TS val 48107734 ecr 48107733], length 2001
15:39:25.072069 IP localhost.postgres > localhost.49472: Flags [P.], seq 61842:62867, ack 33919, win 3637, options [nop,nop,TS val 48107734 ecr 48107733], length 1025
15:39:25.072375 IP localhost.48795 > localhost.postgres: Flags [P.], seq 24452:26385, ack 34018, win 9212, options [nop,nop,TS val 48107735 ecr 48107719], length 1933
15:39:25.072804 IP localhost.webcache > localhost.57645: Flags [P.], seq 1:16615, ack 620, win 593, options [nop,nop,TS val 48107735 ecr 48107690], length 16614: HTTP: HTTP/1.1 200 OK
15:39:25.072837 IP localhost.webcache > localhost.57645: Flags [P.], seq 16615:20738, ack 620, win 593, options [nop,nop,TS val 48107735 ecr 48107690], length 4123: HTTP
15:39:25.073617 IP localhost.49521 > localhost.postgres: Flags [P.], seq 11878:12261, ack 19156, win 19446, options [nop,nop,TS val 48107736 ecr 48107736], length 383
15:39:25.073625 IP localhost.49472 > localhost.postgres: Flags [P.], seq 33919:35852, ack 62867, win 18423, options [nop,nop,TS val 48107736 ecr 48107734], length 1933
15:39:25.073935 IP localhost.postgres > localhost.49521: Flags [P.], seq 19156:21597, ack 12261, win 20470, options [nop,nop,TS val 48107736 ecr 48107736], length 2441
